{
  "$schema": "../../schemas/spec-capability-coverage.schema.json",
  "schemaVersion": 1,
  "recordType": "spec-capability-coverage",
  "id": "retail/spec-capability-coverage",
  "status": "verified",
  "validity": { "fromBuild": "12.1.0.69587", "untilBuild": null, "seasonId": null, "seasonSlug": "midnight-season-2" },
  "isComplete": false,
  "entries": [
    { "specId": 264, "slug": "restoration-shaman", "recordId": "shaman/restoration/capabilities" },
    { "specId": 263, "slug": "enhancement-shaman", "recordId": "shaman/enhancement/capabilities" },
    { "specId": 253, "slug": "beast-mastery-hunter", "recordId": "hunter/beast-mastery/capabilities" },
    { "specId": 254, "slug": "marksmanship-hunter", "recordId": "hunter/marksmanship/capabilities" },
    { "specId": 255, "slug": "survival-hunter", "recordId": "hunter/survival/capabilities" },
    { "specId": 65, "slug": "holy-paladin", "recordId": "paladin/holy/capabilities" },
    { "specId": 66, "slug": "protection-paladin", "recordId": "paladin/protection/capabilities" },
    { "specId": 70, "slug": "retribution-paladin", "recordId": "paladin/retribution/capabilities" },
    { "specId": 102, "slug": "balance-druid", "recordId": "druid/balance/capabilities" },
    { "specId": 103, "slug": "feral-druid", "recordId": "druid/feral/capabilities" },
    { "specId": 104, "slug": "guardian-druid", "recordId": "druid/guardian/capabilities" },
    { "specId": 105, "slug": "restoration-druid", "recordId": "druid/restoration/capabilities" },
    { "specId": 256, "slug": "discipline-priest", "recordId": "priest/discipline/capabilities" },
    { "specId": 257, "slug": "holy-priest", "recordId": "priest/holy/capabilities" },
    { "specId": 258, "slug": "shadow-priest", "recordId": "priest/shadow/capabilities" },
    { "specId": 62, "slug": "arcane-mage", "recordId": "mage/arcane/capabilities" },
    { "specId": 63, "slug": "fire-mage", "recordId": "mage/fire/capabilities" },
    { "specId": 64, "slug": "frost-mage", "recordId": "mage/frost/capabilities" }
  ],
  "missingDataMeaning": "A specialization absent from this partial catalog is not yet modeled. Absence must never be interpreted as evidence that the specialization lacks a capability.",
  "provenance": [
    { "kind": "curated", "description": "Generated from and cross-checked against every specialization capability entry in data/index.json.", "recordId": "data/index.json", "retrievedAt": "2026-09-02T20:00:00+02:00" }
  ]
}
